{
  "schemaVersion": "1.0.0",
  "id": "project-acme-labs:revision:1",
  "workspaceId": "standalone",
  "projectId": "project-acme-labs",
  "revision": 1,
  "status": "active",
  "createdAt": "2026-06-01T12:00:00.000Z",
  "updatedAt": "2026-06-02T15:30:00.000Z",
  "data": {
    "schemaVersion": "0.1.0",
    "meta": {
      "createdAt": "2026-06-01T12:00:00.000Z",
      "updatedAt": "2026-06-02T15:30:00.000Z",
      "completionStatus": "ready_for_research"
    },
    "project": {
      "slug": "acme-labs",
      "name": "Acme Labs",
      "startingPoint": "rodando"
    },
    "market": {
      "niche": "educacao",
      "dominantPain": "Baixa previsibilidade de demanda"
    }
  },
  "fieldSources": {
    "project.name": {
      "source": "user",
      "confirmation": "confirmed",
      "updatedAt": "2026-06-01T12:10:00.000Z"
    },
    "market.niche": {
      "source": "artifact",
      "confirmation": "confirmed",
      "sourceArtifactId": "avatar-funil.md",
      "updatedAt": "2026-06-02T14:00:00.000Z"
    },
    "market.dominantPain": {
      "source": "migration",
      "confirmation": "pending",
      "updatedAt": "2026-06-02T15:00:00.000Z"
    },
    "offer.guarantee": {
      "source": "migration",
      "confirmation": "not_applicable",
      "updatedAt": "2026-06-02T15:10:00.000Z"
    }
  }
}
